ID,text,alternatives
1,Un bate y una pelota cuestan $1100 en total. El bate cuesta $1000 más que la pelota ¿Cuánto cuesta la pelota?,
2,Si 5 máquinas se demoran 5 minutos en hacer 5 audífonos ¿Cuántos minutos se demorarían 100 máquinas en hacer 100 audífonos?,
3,"Parte de la superficie de un lago está cubierta de hojas de lirio. Esta parte, se dobla en tamaño cada día. Si las hojas de lirio demoran 48 días en cubrir el lago completo ¿Cuántos días tardarían en cubrir la mitad del lago?",
4,Si José puede tomar un litro de agua en 6 días y María puede tomar un litro de agua en 12 días ¿Cuánto se demorarían ambos en tomar un litro de agua juntos?,
5,Pedro recibió la quinceava nota más alta y la quinceava nota más baja en su clase ¿Cuántos estudiantes hay en su clase?,
6,"Un hombre compra un cerdo a $60000, lo vende a $70.000, lo compra de nuevo por $80000, y lo vuelve a vender finalmente por $90000 ¿Cuánta plata ha ganado?",
7,"Simón decide invertir $8000000 en el mercado de acciones un día a inicios de 2008. Seis meses después de haber invertido, el 17 de julio, las acciones que había comprado bajaron 50%. Afortunadamente para Simón, desde el 17 de julio hasta el 17 de octubre, las acciones que compró subieron 75%. En este punto, Simón ha:","'No ha ganado ni perdido dinero', 'Ha ganado dinero', 'Ha perdido dinero'"
